{
  "templateName": "alias-correction-checklist",
  "release": "7.19",
  "groupKey": "12u-boys",
  "aliasReviewItems": [
    {
      "rawSourceName": "",
      "proposedDisplayName": "",
      "proposedTeamKey": "",
      "clubKey": "",
      "age": "12U",
      "gender": "Boys",
      "teamDesignation": "A|B|C|Red|Blue|Navy|Black|Unknown",
      "relatedKnownAliases": [],
      "mergeDecision": "merge|do-not-merge|new-team|manual-review",
      "reason": "",
      "evidence": [],
      "reviewer": "",
      "status": "pending|approved|rejected"
    }
  ],
  "rules": [
    "Do not merge across age/gender groups.",
    "Do not merge A/B/C or color teams unless the source confirms same roster identity.",
    "Preserve raw source names for auditability."
  ]
}
